id,name,description
1,Electronics,"High-tech gadgets, computers, smartphones, audio equipment, and cutting-edge technological devices for personal and professional use."
2,Home Decor,"Decorative items, furniture, wall art, lighting fixtures, and accessories to enhance and personalize living spaces."
3,Sports & Fitness,"Athletic equipment, workout gear, sporting goods, exercise machines, and accessories for various sports and fitness activities."
4,Fashion & Apparel,"Clothing, shoes, accessories, and jewelry for men, women, and children across different styles and occasions."
5,Kitchen & Cooking,"Cookware, kitchen appliances, utensils, bakeware, small electric devices, and culinary tools for home chefs and cooking enthusiasts."
